{
  "LoanId": 100333,
  "LoanActiveFlag": true,
  "EscrowFlag": true,
  "PaidOffFlag": false,
  "ChargedOffFlag": false,
  "UnpaidPrincipalBalanceAmount": 198234.67,
  "NextPaymentDueDate": "2026-06-01T00:00:00",
  "LastPaymentReceivedDate": "2026-05-01T00:00:00",
  "CurrentInterestRate": 0.04875,
  "CurrentMonthlyPaymentAmount": 1042.1,
  "CurrentEscrowMonthlyPaymentAmount": 445,
  "CurrentTotalMonthlyPaymentAmount": 1487.1,
  "MortgageTypeDescription": "FHA 30yr fixed",
  "PropertyRegion": "FL",
  "MailingRegion": "FL",
  "LoanMaturityDate": "2053-03-01T00:00:00",
  "InvestorName": "Synthetic Ginnie Pool",
  "DelinquentPaymentCount": 0,
  "DelinquentAtBoardingFlag": false,
  "LossMitigationTemplateDescription": null,
  "ForeclosureStatusDescription": null,
  "BankruptcyStatusDescription": "not mapped",
  "EscrowBalanceAmount": 1500,
  "LastEscrowAnalysisDate": "2026-05-01T00:00:00",
  "MonthlyCountyTaxAmount": 267,
  "MonthlyHazardInsuranceAmount": 178,
  "MonthlyMortgageInsuranceAmount": 0,
  "MonthlyOverageShortageAmount": 20,
  "PaymentScheduleDueMonth": "2026-06-01T00:00:00",
  "BorrowerSummary": [
    {
      "BorrowerId": 900333,
      "LoanId": 100333,
      "BorrowerOrdinal": 1,
      "BorrowerFirstName": "Riley",
      "BorrowerLastName": "Cooper",
      "BorrowerMiddleName": "",
      "BorrowerUnparsedName": "Riley Cooper",
      "BorrowerMailingLocality": "Synthetic City",
      "BorrowerMailingRegion": "FL",
      "BorrowerMailingPostalCode": "00000",
      "BorrowerEmailAddress": "riley.cooper@example.test",
      "BorrowerPrimaryPhoneNumber": "5550100",
      "ObligorFlag": true
    }
  ]
}
