{
  "LoanId": 1000002245,
  "LoanActiveFlag": false,
  "EscrowFlag": true,
  "PaidOffFlag": false,
  "ChargedOffFlag": false,
  "UnpaidPrincipalBalanceAmount": 0,
  "NextPaymentDueDate": "2010-07-01T00:00:00",
  "LastPaymentReceivedDate": "2010-06-10T00:00:00",
  "CurrentInterestRate": 0.03328,
  "CurrentMonthlyPaymentAmount": 681.15,
  "CurrentEscrowMonthlyPaymentAmount": 284.73,
  "CurrentTotalMonthlyPaymentAmount": 965.88,
  "MortgageTypeDescription": "Conventional W/O PMI",
  "PropertyRegion": "AZ",
  "MailingRegion": "AZ",
  "LoanMaturityDate": "2036-12-01T00:00:00",
  "InvestorName": "FNBN Synthetic LLC",
  "DelinquentPaymentCount": 0,
  "DelinquentAtBoardingFlag": false,
  "LossMitigationTemplateDescription": "Short Sale",
  "ForeclosureStatusDescription": "Removed",
  "BankruptcyStatusDescription": "not mapped",
  "EscrowBalanceAmount": 1500,
  "LastEscrowAnalysisDate": "2010-06-10T00:00:00",
  "MonthlyCountyTaxAmount": 170.84,
  "MonthlyHazardInsuranceAmount": 113.89,
  "MonthlyMortgageInsuranceAmount": 0,
  "MonthlyOverageShortageAmount": 20,
  "PaymentScheduleDueMonth": "2010-07-01T00:00:00",
  "BorrowerSummary": [
    {
      "BorrowerId": 902245,
      "LoanId": 1000002245,
      "BorrowerOrdinal": 1,
      "BorrowerFirstName": "Pat",
      "BorrowerLastName": "Nguyen",
      "BorrowerMiddleName": "",
      "BorrowerUnparsedName": "Pat Nguyen",
      "BorrowerMailingLocality": "Synthetic City",
      "BorrowerMailingRegion": "AZ",
      "BorrowerMailingPostalCode": "00000",
      "BorrowerEmailAddress": "pat.nguyen@example.test",
      "BorrowerPrimaryPhoneNumber": "5550100",
      "ObligorFlag": true
    }
  ]
}
