{
  "LoanId": 100207,
  "LoanActiveFlag": true,
  "EscrowFlag": false,
  "PaidOffFlag": false,
  "ChargedOffFlag": false,
  "UnpaidPrincipalBalanceAmount": 289543.2,
  "NextPaymentDueDate": "2026-05-01T00:00:00",
  "LastPaymentReceivedDate": "2026-02-01T00:00:00",
  "CurrentInterestRate": 0.04625,
  "CurrentMonthlyPaymentAmount": 1488.9,
  "CurrentEscrowMonthlyPaymentAmount": 0,
  "CurrentTotalMonthlyPaymentAmount": 1488.9,
  "MortgageTypeDescription": "Conventional 30yr fixed",
  "PropertyRegion": "NY",
  "MailingRegion": "NY",
  "LoanMaturityDate": "2052-08-01T00:00:00",
  "InvestorName": "Synthetic Portfolio Trust",
  "DelinquentPaymentCount": 3,
  "DelinquentAtBoardingFlag": false,
  "LossMitigationTemplateDescription": null,
  "ForeclosureStatusDescription": null,
  "BankruptcyStatusDescription": "not mapped",
  "EscrowBalanceAmount": 0,
  "LastEscrowAnalysisDate": "2026-02-01T00:00:00",
  "MonthlyCountyTaxAmount": 0,
  "MonthlyHazardInsuranceAmount": 0,
  "MonthlyMortgageInsuranceAmount": 0,
  "MonthlyOverageShortageAmount": 20,
  "PaymentScheduleDueMonth": "2026-05-01T00:00:00",
  "BorrowerSummary": [
    {
      "BorrowerId": 900207,
      "LoanId": 100207,
      "BorrowerOrdinal": 1,
      "BorrowerFirstName": "Morgan",
      "BorrowerLastName": "Whitfield",
      "BorrowerMiddleName": "",
      "BorrowerUnparsedName": "Morgan Whitfield",
      "BorrowerMailingLocality": "Synthetic City",
      "BorrowerMailingRegion": "NY",
      "BorrowerMailingPostalCode": "00000",
      "BorrowerEmailAddress": "morgan.whitfield@example.test",
      "BorrowerPrimaryPhoneNumber": "5550100",
      "ObligorFlag": true
    }
  ]
}
