{
  "LoanId": 100620,
  "LoanActiveFlag": true,
  "EscrowFlag": true,
  "PaidOffFlag": false,
  "ChargedOffFlag": false,
  "UnpaidPrincipalBalanceAmount": 275000,
  "NextPaymentDueDate": "2026-07-01T00:00:00",
  "LastPaymentReceivedDate": "2026-06-01T00:00:00",
  "CurrentInterestRate": 0.044,
  "CurrentMonthlyPaymentAmount": 1385,
  "CurrentEscrowMonthlyPaymentAmount": 475,
  "CurrentTotalMonthlyPaymentAmount": 1860,
  "MortgageTypeDescription": "Conventional 30yr fixed",
  "PropertyRegion": "WA",
  "MailingRegion": "WA",
  "LoanMaturityDate": "2055-01-01T00:00:00",
  "InvestorName": "Synthetic West Pool",
  "DelinquentPaymentCount": 0,
  "DelinquentAtBoardingFlag": false,
  "LossMitigationTemplateDescription": null,
  "ForeclosureStatusDescription": null,
  "BankruptcyStatusDescription": "not mapped",
  "EscrowBalanceAmount": 1500,
  "LastEscrowAnalysisDate": "2026-06-01T00:00:00",
  "MonthlyCountyTaxAmount": 285,
  "MonthlyHazardInsuranceAmount": 190,
  "MonthlyMortgageInsuranceAmount": 0,
  "MonthlyOverageShortageAmount": 20,
  "PaymentScheduleDueMonth": "2026-07-01T00:00:00",
  "BorrowerSummary": [
    {
      "BorrowerId": 900620,
      "LoanId": 100620,
      "BorrowerOrdinal": 1,
      "BorrowerFirstName": "Avery",
      "BorrowerLastName": "Brooks",
      "BorrowerMiddleName": "",
      "BorrowerUnparsedName": "Avery Brooks",
      "BorrowerMailingLocality": "Synthetic City",
      "BorrowerMailingRegion": "WA",
      "BorrowerMailingPostalCode": "00000",
      "BorrowerEmailAddress": "avery.brooks@example.test",
      "BorrowerPrimaryPhoneNumber": "5550100",
      "ObligorFlag": true
    }
  ]
}
