{
  "LoanId": 100401,
  "LoanActiveFlag": true,
  "EscrowFlag": true,
  "PaidOffFlag": false,
  "ChargedOffFlag": false,
  "UnpaidPrincipalBalanceAmount": 348901.23,
  "NextPaymentDueDate": "2026-06-01T00:00:00",
  "LastPaymentReceivedDate": "2026-05-01T00:00:00",
  "CurrentInterestRate": 0.0425,
  "CurrentMonthlyPaymentAmount": 1712.4,
  "CurrentEscrowMonthlyPaymentAmount": 590,
  "CurrentTotalMonthlyPaymentAmount": 2302.4,
  "MortgageTypeDescription": "Conventional 30yr fixed",
  "PropertyRegion": "NY",
  "MailingRegion": "NY",
  "LoanMaturityDate": "2054-09-01T00:00:00",
  "InvestorName": "Synthetic Investor LLC",
  "DelinquentPaymentCount": 0,
  "DelinquentAtBoardingFlag": false,
  "LossMitigationTemplateDescription": null,
  "ForeclosureStatusDescription": null,
  "BankruptcyStatusDescription": "not mapped",
  "EscrowBalanceAmount": 1500,
  "LastEscrowAnalysisDate": "2026-05-01T00:00:00",
  "MonthlyCountyTaxAmount": 354,
  "MonthlyHazardInsuranceAmount": 236,
  "MonthlyMortgageInsuranceAmount": 0,
  "MonthlyOverageShortageAmount": 20,
  "PaymentScheduleDueMonth": "2026-06-01T00:00:00",
  "BorrowerSummary": [
    {
      "BorrowerId": 900401,
      "LoanId": 100401,
      "BorrowerOrdinal": 1,
      "BorrowerFirstName": "Sam",
      "BorrowerLastName": "Patel",
      "BorrowerMiddleName": "",
      "BorrowerUnparsedName": "Sam Patel",
      "BorrowerMailingLocality": "Synthetic City",
      "BorrowerMailingRegion": "NY",
      "BorrowerMailingPostalCode": "00000",
      "BorrowerEmailAddress": "sam.patel@example.test",
      "BorrowerPrimaryPhoneNumber": "5550100",
      "ObligorFlag": true
    }
  ]
}
