{
  "LoanId": 100515,
  "LoanActiveFlag": true,
  "EscrowFlag": true,
  "PaidOffFlag": false,
  "ChargedOffFlag": false,
  "UnpaidPrincipalBalanceAmount": 156789.5,
  "NextPaymentDueDate": "2026-06-01T00:00:00",
  "LastPaymentReceivedDate": "2025-11-01T00:00:00",
  "CurrentInterestRate": 0.035,
  "CurrentMonthlyPaymentAmount": 704.55,
  "CurrentEscrowMonthlyPaymentAmount": 380,
  "CurrentTotalMonthlyPaymentAmount": 1084.55,
  "MortgageTypeDescription": "VA 30yr fixed",
  "PropertyRegion": "OH",
  "MailingRegion": "OH",
  "LoanMaturityDate": "2050-01-01T00:00:00",
  "InvestorName": "Synthetic VA Pool",
  "DelinquentPaymentCount": 6,
  "DelinquentAtBoardingFlag": false,
  "LossMitigationTemplateDescription": null,
  "ForeclosureStatusDescription": null,
  "BankruptcyStatusDescription": "not mapped",
  "EscrowBalanceAmount": 1500,
  "LastEscrowAnalysisDate": "2025-11-01T00:00:00",
  "MonthlyCountyTaxAmount": 228,
  "MonthlyHazardInsuranceAmount": 152,
  "MonthlyMortgageInsuranceAmount": 0,
  "MonthlyOverageShortageAmount": 20,
  "PaymentScheduleDueMonth": "2026-06-01T00:00:00",
  "BorrowerSummary": [
    {
      "BorrowerId": 900515,
      "LoanId": 100515,
      "BorrowerOrdinal": 1,
      "BorrowerFirstName": "Casey",
      "BorrowerLastName": "Adams",
      "BorrowerMiddleName": "",
      "BorrowerUnparsedName": "Casey Adams",
      "BorrowerMailingLocality": "Synthetic City",
      "BorrowerMailingRegion": "OH",
      "BorrowerMailingPostalCode": "00000",
      "BorrowerEmailAddress": "casey.adams@example.test",
      "BorrowerPrimaryPhoneNumber": "5550100",
      "ObligorFlag": true
    }
  ]
}
