{
  "LoanId": 100830,
  "LoanActiveFlag": true,
  "EscrowFlag": true,
  "PaidOffFlag": false,
  "ChargedOffFlag": false,
  "UnpaidPrincipalBalanceAmount": 301200.5,
  "NextPaymentDueDate": "2026-06-01T00:00:00",
  "LastPaymentReceivedDate": "2026-05-01T00:00:00",
  "CurrentInterestRate": 0.046,
  "CurrentMonthlyPaymentAmount": 1520.8,
  "CurrentEscrowMonthlyPaymentAmount": 525,
  "CurrentTotalMonthlyPaymentAmount": 2045.8,
  "MortgageTypeDescription": "Conventional 30yr fixed",
  "PropertyRegion": "IL",
  "MailingRegion": "IL",
  "LoanMaturityDate": "2053-07-01T00:00:00",
  "InvestorName": "Synthetic Midwest Trust",
  "DelinquentPaymentCount": 0,
  "DelinquentAtBoardingFlag": false,
  "LossMitigationTemplateDescription": null,
  "ForeclosureStatusDescription": null,
  "BankruptcyStatusDescription": "not mapped",
  "EscrowBalanceAmount": 1500,
  "LastEscrowAnalysisDate": "2026-05-01T00:00:00",
  "MonthlyCountyTaxAmount": 315,
  "MonthlyHazardInsuranceAmount": 210,
  "MonthlyMortgageInsuranceAmount": 0,
  "MonthlyOverageShortageAmount": 20,
  "PaymentScheduleDueMonth": "2026-06-01T00:00:00",
  "BorrowerSummary": [
    {
      "BorrowerId": 900830,
      "LoanId": 100830,
      "BorrowerOrdinal": 1,
      "BorrowerFirstName": "Reese",
      "BorrowerLastName": "Morgan",
      "BorrowerMiddleName": "",
      "BorrowerUnparsedName": "Reese Morgan",
      "BorrowerMailingLocality": "Synthetic City",
      "BorrowerMailingRegion": "IL",
      "BorrowerMailingPostalCode": "00000",
      "BorrowerEmailAddress": "reese.morgan@example.test",
      "BorrowerPrimaryPhoneNumber": "5550100",
      "ObligorFlag": true
    }
  ]
}
