{
  "LoanId": 100118,
  "LoanActiveFlag": true,
  "EscrowFlag": true,
  "PaidOffFlag": false,
  "ChargedOffFlag": false,
  "UnpaidPrincipalBalanceAmount": 412567.8,
  "NextPaymentDueDate": "2026-06-01T00:00:00",
  "LastPaymentReceivedDate": "2026-05-01T00:00:00",
  "CurrentInterestRate": 0.04125,
  "CurrentMonthlyPaymentAmount": 1988.4,
  "CurrentEscrowMonthlyPaymentAmount": 640,
  "CurrentTotalMonthlyPaymentAmount": 2628.4,
  "MortgageTypeDescription": "Conventional 30yr fixed",
  "PropertyRegion": "CA",
  "MailingRegion": "CA",
  "LoanMaturityDate": "2053-11-01T00:00:00",
  "InvestorName": "Synthetic Investor LLC",
  "DelinquentPaymentCount": 0,
  "DelinquentAtBoardingFlag": false,
  "LossMitigationTemplateDescription": null,
  "ForeclosureStatusDescription": null,
  "BankruptcyStatusDescription": "not mapped",
  "EscrowBalanceAmount": 1500,
  "LastEscrowAnalysisDate": "2026-05-01T00:00:00",
  "MonthlyCountyTaxAmount": 384,
  "MonthlyHazardInsuranceAmount": 256,
  "MonthlyMortgageInsuranceAmount": 0,
  "MonthlyOverageShortageAmount": 20,
  "PaymentScheduleDueMonth": "2026-06-01T00:00:00",
  "BorrowerSummary": [
    {
      "BorrowerId": 900118,
      "LoanId": 100118,
      "BorrowerOrdinal": 1,
      "BorrowerFirstName": "Maria",
      "BorrowerLastName": "Santos",
      "BorrowerMiddleName": "",
      "BorrowerUnparsedName": "Maria Santos",
      "BorrowerMailingLocality": "Synthetic City",
      "BorrowerMailingRegion": "CA",
      "BorrowerMailingPostalCode": "00000",
      "BorrowerEmailAddress": "maria.santos@example.test",
      "BorrowerPrimaryPhoneNumber": "5550100",
      "ObligorFlag": true
    }
  ]
}
