{
  "LoanId": 100721,
  "LoanActiveFlag": true,
  "EscrowFlag": true,
  "PaidOffFlag": false,
  "ChargedOffFlag": false,
  "UnpaidPrincipalBalanceAmount": 165432,
  "NextPaymentDueDate": "2026-06-01T00:00:00",
  "LastPaymentReceivedDate": "2026-04-01T00:00:00",
  "CurrentInterestRate": 0.051,
  "CurrentMonthlyPaymentAmount": 890.25,
  "CurrentEscrowMonthlyPaymentAmount": 360,
  "CurrentTotalMonthlyPaymentAmount": 1250.25,
  "MortgageTypeDescription": "FHA 30yr fixed",
  "PropertyRegion": "GA",
  "MailingRegion": "GA",
  "LoanMaturityDate": "2052-12-01T00:00:00",
  "InvestorName": "Synthetic Ginnie Pool",
  "DelinquentPaymentCount": 1,
  "DelinquentAtBoardingFlag": false,
  "LossMitigationTemplateDescription": null,
  "ForeclosureStatusDescription": null,
  "BankruptcyStatusDescription": "not mapped",
  "EscrowBalanceAmount": 1500,
  "LastEscrowAnalysisDate": "2026-04-01T00:00:00",
  "MonthlyCountyTaxAmount": 216,
  "MonthlyHazardInsuranceAmount": 144,
  "MonthlyMortgageInsuranceAmount": 0,
  "MonthlyOverageShortageAmount": 20,
  "PaymentScheduleDueMonth": "2026-06-01T00:00:00",
  "BorrowerSummary": [
    {
      "BorrowerId": 900721,
      "LoanId": 100721,
      "BorrowerOrdinal": 1,
      "BorrowerFirstName": "Quinn",
      "BorrowerLastName": "Harper",
      "BorrowerMiddleName": "",
      "BorrowerUnparsedName": "Quinn Harper",
      "BorrowerMailingLocality": "Synthetic City",
      "BorrowerMailingRegion": "GA",
      "BorrowerMailingPostalCode": "00000",
      "BorrowerEmailAddress": "quinn.harper@example.test",
      "BorrowerPrimaryPhoneNumber": "5550100",
      "ObligorFlag": true
    }
  ]
}
