{
  "LoanId": 100311,
  "LoanActiveFlag": true,
  "EscrowFlag": true,
  "PaidOffFlag": false,
  "ChargedOffFlag": false,
  "UnpaidPrincipalBalanceAmount": 187432.1,
  "NextPaymentDueDate": "2026-06-01T00:00:00",
  "LastPaymentReceivedDate": "2026-03-01T00:00:00",
  "CurrentInterestRate": 0.0525,
  "CurrentMonthlyPaymentAmount": 1034.22,
  "CurrentEscrowMonthlyPaymentAmount": 420,
  "CurrentTotalMonthlyPaymentAmount": 1454.22,
  "MortgageTypeDescription": "FHA 30yr fixed",
  "PropertyRegion": "TX",
  "MailingRegion": "TX",
  "LoanMaturityDate": "2051-02-01T00:00:00",
  "InvestorName": "Synthetic Ginnie Pool",
  "DelinquentPaymentCount": 2,
  "DelinquentAtBoardingFlag": false,
  "LossMitigationTemplateDescription": null,
  "ForeclosureStatusDescription": null,
  "BankruptcyStatusDescription": "not mapped",
  "EscrowBalanceAmount": 1500,
  "LastEscrowAnalysisDate": "2026-03-01T00:00:00",
  "MonthlyCountyTaxAmount": 252,
  "MonthlyHazardInsuranceAmount": 168,
  "MonthlyMortgageInsuranceAmount": 0,
  "MonthlyOverageShortageAmount": 20,
  "PaymentScheduleDueMonth": "2026-06-01T00:00:00",
  "BorrowerSummary": [
    {
      "BorrowerId": 900311,
      "LoanId": 100311,
      "BorrowerOrdinal": 1,
      "BorrowerFirstName": "Jamie",
      "BorrowerLastName": "Chen",
      "BorrowerMiddleName": "",
      "BorrowerUnparsedName": "Jamie Chen",
      "BorrowerMailingLocality": "Synthetic City",
      "BorrowerMailingRegion": "TX",
      "BorrowerMailingPostalCode": "00000",
      "BorrowerEmailAddress": "jamie.chen@example.test",
      "BorrowerPrimaryPhoneNumber": "5550100",
      "ObligorFlag": true
    }
  ]
}
