{
  "LoanId": 100402,
  "LoanActiveFlag": true,
  "EscrowFlag": true,
  "PaidOffFlag": false,
  "ChargedOffFlag": false,
  "UnpaidPrincipalBalanceAmount": 215678.35,
  "NextPaymentDueDate": "2026-06-01T00:00:00",
  "LastPaymentReceivedDate": "2026-05-01T00:00:00",
  "CurrentInterestRate": 0.03875,
  "CurrentMonthlyPaymentAmount": 1575.2,
  "CurrentEscrowMonthlyPaymentAmount": 510,
  "CurrentTotalMonthlyPaymentAmount": 2085.2,
  "MortgageTypeDescription": "Conventional 15yr fixed",
  "PropertyRegion": "FL",
  "MailingRegion": "FL",
  "LoanMaturityDate": "2039-04-01T00:00:00",
  "InvestorName": "Synthetic Investor LLC",
  "DelinquentPaymentCount": 0,
  "DelinquentAtBoardingFlag": false,
  "LossMitigationTemplateDescription": null,
  "ForeclosureStatusDescription": null,
  "BankruptcyStatusDescription": "not mapped",
  "EscrowBalanceAmount": 1500,
  "LastEscrowAnalysisDate": "2026-05-01T00:00:00",
  "MonthlyCountyTaxAmount": 306,
  "MonthlyHazardInsuranceAmount": 204,
  "MonthlyMortgageInsuranceAmount": 0,
  "MonthlyOverageShortageAmount": 20,
  "PaymentScheduleDueMonth": "2026-06-01T00:00:00",
  "BorrowerSummary": [
    {
      "BorrowerId": 900402,
      "LoanId": 100402,
      "BorrowerOrdinal": 1,
      "BorrowerFirstName": "Jordan",
      "BorrowerLastName": "Taylor",
      "BorrowerMiddleName": "",
      "BorrowerUnparsedName": "Jordan Taylor",
      "BorrowerMailingLocality": "Synthetic City",
      "BorrowerMailingRegion": "FL",
      "BorrowerMailingPostalCode": "00000",
      "BorrowerEmailAddress": "jordan.taylor@example.test",
      "BorrowerPrimaryPhoneNumber": "5550100",
      "ObligorFlag": true
    }
  ]
}
