{
  "LoanId": 100245,
  "LoanActiveFlag": true,
  "EscrowFlag": true,
  "PaidOffFlag": false,
  "ChargedOffFlag": false,
  "UnpaidPrincipalBalanceAmount": 324188.42,
  "NextPaymentDueDate": "2026-06-01T00:00:00",
  "LastPaymentReceivedDate": "2026-05-01T00:00:00",
  "CurrentInterestRate": 0.04375,
  "CurrentMonthlyPaymentAmount": 1592.67,
  "CurrentEscrowMonthlyPaymentAmount": 615.3,
  "CurrentTotalMonthlyPaymentAmount": 2207.97,
  "MortgageTypeDescription": "Conventional 30yr fixed",
  "PropertyRegion": "CA",
  "MailingRegion": "CA",
  "LoanMaturityDate": "2054-05-01T00:00:00",
  "InvestorName": "Synthetic Investor LLC",
  "DelinquentPaymentCount": 0,
  "DelinquentAtBoardingFlag": false,
  "LossMitigationTemplateDescription": null,
  "ForeclosureStatusDescription": null,
  "BankruptcyStatusDescription": "not mapped",
  "EscrowBalanceAmount": 1500,
  "LastEscrowAnalysisDate": "2026-05-01T00:00:00",
  "MonthlyCountyTaxAmount": 369.18,
  "MonthlyHazardInsuranceAmount": 246.12,
  "MonthlyMortgageInsuranceAmount": 0,
  "MonthlyOverageShortageAmount": 20,
  "PaymentScheduleDueMonth": "2026-06-01T00:00:00",
  "BorrowerSummary": [
    {
      "BorrowerId": 900245,
      "LoanId": 100245,
      "BorrowerOrdinal": 1,
      "BorrowerFirstName": "Alex",
      "BorrowerLastName": "Rivera",
      "BorrowerMiddleName": "",
      "BorrowerUnparsedName": "Alex Rivera",
      "BorrowerMailingLocality": "Synthetic City",
      "BorrowerMailingRegion": "CA",
      "BorrowerMailingPostalCode": "00000",
      "BorrowerEmailAddress": "alex.rivera@example.test",
      "BorrowerPrimaryPhoneNumber": "5550100",
      "ObligorFlag": true
    }
  ]
}
