{
  "LoanId": 100910,
  "LoanActiveFlag": false,
  "EscrowFlag": false,
  "PaidOffFlag": false,
  "ChargedOffFlag": false,
  "UnpaidPrincipalBalanceAmount": 0,
  "NextPaymentDueDate": "2024-12-01T00:00:00",
  "LastPaymentReceivedDate": "2024-11-15T00:00:00",
  "CurrentInterestRate": 0.0375,
  "CurrentMonthlyPaymentAmount": 0,
  "CurrentEscrowMonthlyPaymentAmount": 0,
  "CurrentTotalMonthlyPaymentAmount": 0,
  "MortgageTypeDescription": "Conventional 30yr fixed",
  "PropertyRegion": "CO",
  "MailingRegion": "CO",
  "LoanMaturityDate": "2048-06-01T00:00:00",
  "InvestorName": "Synthetic Investor LLC",
  "DelinquentPaymentCount": 0,
  "DelinquentAtBoardingFlag": false,
  "LossMitigationTemplateDescription": null,
  "ForeclosureStatusDescription": "Removed",
  "BankruptcyStatusDescription": "not mapped",
  "EscrowBalanceAmount": 0,
  "LastEscrowAnalysisDate": "2024-11-15T00:00:00",
  "MonthlyCountyTaxAmount": 0,
  "MonthlyHazardInsuranceAmount": 0,
  "MonthlyMortgageInsuranceAmount": 0,
  "MonthlyOverageShortageAmount": 20,
  "PaymentScheduleDueMonth": "2024-12-01T00:00:00",
  "BorrowerSummary": [
    {
      "BorrowerId": 900910,
      "LoanId": 100910,
      "BorrowerOrdinal": 1,
      "BorrowerFirstName": "Drew",
      "BorrowerLastName": "Keller",
      "BorrowerMiddleName": "",
      "BorrowerUnparsedName": "Drew Keller",
      "BorrowerMailingLocality": "Synthetic City",
      "BorrowerMailingRegion": "CO",
      "BorrowerMailingPostalCode": "00000",
      "BorrowerEmailAddress": "drew.keller@example.test",
      "BorrowerPrimaryPhoneNumber": "5550100",
      "ObligorFlag": true
    }
  ]
}
